{
  "schemaVersion": 1,
  "id": "rejuvenation:warped_forest",
  "originalId": "WARPEDFOREST",
  "name": "Warped Forest Field",
  "entryMessage": "The forest twitches grotesquely...",
  "specification": "Warped_Forest_Field.md",
  "base": "INDOOR",
  "hooks": {
    "naturePower": "woodhammer",
    "secretPower": "woodhammer",
    "mimicry": "Dark",
    "secretPowerEffects": [{"volatileStatus": "flinch"}]
  },
  "types": [
    {"type": "Grass", "multiplier": 1.5, "message": "The forestry strengthened the attack!"},
    {"type": "Bug", "category": "Special", "multiplier": 1.5, "message": "The attack spread throughout the forest!"},
    {"type": "Dark", "multiplier": 1.5, "message": "The darkness is here..."},
    {"type": "Ghost", "multiplier": 1.2, "message": "The evil aura powered up the attack..."},
    {"type": "Fairy", "multiplier": 0.5, "message": "The evil aura depleted the attack!"},
    {"type": "Fire", "multiplier": 1.3, "message": "The Nether's heat strengthened the attack!"},
    {"type": "Ice", "multiplier": 0.5, "message": "The Nether's heat softened the attack..."},
    {"type": "Water", "multiplier": 0.8, "message": "The Nether's heat weakened the attack..."}
  ],
  "moves": {
    "powerwhip": {"multiplier": 1.5, "message": "The warped roots lashed out!"},
    "vinewhip": {"multiplier": 1.5, "message": "The warped roots lashed out!"},
    "hyperspacefury": {"multiplier": 1.5, "message": "Space warped between the twisting trees!"},
    "hyperspacehole": {"multiplier": 1.5, "message": "Space warped between the twisting trees!"},
    "shadowforce": {"multiplier": 1.5, "message": "Space warped between the twisting trees!"},
    "spacialrend": {"multiplier": 1.5, "message": "Space warped between the twisting trees!"},
    "darkpulse": {"multiplier": 1.2, "accuracy": 0, "message": "The warped forest folded around the attack!"},
    "nightdaze": {"multiplier": 1.2, "accuracy": 0, "message": "The warped forest folded around the attack!"}
  },
  "typeComposition": [
    {"whenTypes": ["Grass"], "add": "Dark", "condition": {"not": {"category": "Status"}}, "message": "The warped flora twisted the attack!"}
  ],
  "terrainPulse": {"type": "Dark"},
  "inherit": [
    {"from": "FOREST", "moveRows": {"moves": ["slash", "airslash", "furycutter", "aircutter", "psychocut", "breakingswipe", "cut"], "keys": ["additionalType"]}},
    {"from": "FOREST", "rules": [
      {"event": "residual", "contains": ["sapsipper"], "expect": 1},
      {"event": "setStatus", "contains": ["leafguard"], "expect": 1}
    ], "abilityHandlers": ["overgrow", "swarm", "grasspelt", "effectspore"]},
    {"from": "DIMENSIONAL", "rules": [
      {"event": "switchIn", "contains": ["\"rattled\""], "expect": 1},
      {"event": "switchIn", "contains": ["\"unnerve\""], "expect": 1}
    ], "keys": ["conditionDurations"]},
    {"from": "WASTELAND", "rules": [
      {"event": "residual", "contains": ["poisonheal"], "expect": 1}
    ], "abilityHandlers": ["toxicboost"]},
    {"from": "VOLCANIC", "rules": [
      {"event": "setStatus", "contains": ["\"frz\""], "expect": 1}
    ]}
  ],
  "rules": [
    {
      "event": "receivedDamage",
      "condition": {"move": "leechseed"},
      "actions": [{"op": "multiply", "value": 2}, {"op": "message", "text": "The warped roots burrowed deeper!"}],
      "source": "Warped_Forest_Field.md: Warped Flora (Leech Seed 1/4); Wasteland Leech Seed rule"
    },
    {
      "event": "setWeather",
      "condition": {"always": true},
      "actions": [{"op": "message", "text": "The weather faded into the warped forest..."}, {"op": "reject"}],
      "source": "Warped_Forest_Field.md: Weather effects fail while the field is active"
    },
    {
      "event": "activate",
      "condition": {"all": [{"weatherActive": true}, {"not": {"globalAbility": ["tempest"]}}]},
      "actions": [{"op": "clearWeather", "message": "The weather faded into the warped forest..."}],
      "source": "Warped_Forest_Field.md: Weather effects fail while the field is active (weather present on entry)"
    },
    {
      "event": "weatherChange",
      "condition": {"all": [{"weatherActive": true}, {"not": {"globalAbility": ["tempest"]}}]},
      "actions": [{"op": "clearWeather", "message": "The weather faded into the warped forest..."}],
      "source": "Warped_Forest_Field.md: Weather effects fail while the field is active"
    },
    {
      "event": "weatherReconcile",
      "condition": {"all": [{"weatherActive": true}, {"not": {"globalAbility": ["tempest"]}}]},
      "actions": [{"op": "clearWeather", "message": "The weather faded into the warped forest..."}],
      "source": "Warped_Forest_Field.md: Weather effects fail while the field is active"
    },
    {
      "event": "modifyMove",
      "condition": {"move": "shelter"},
      "actions": [{"op": "moveBehavior", "recipe": "appendHitActions", "actions": [
        {"op": "volatile", "id": "rejuvenationshelter", "message": "{1} is sheltering itself from the surroundings!"}
      ]}],
      "source": "Warped_Forest_Field.md: Standard Field Hooks (Shelter); Battle_MoveEffects.rb:1071-1074"
    },
    {
      "event": "damage",
      "condition": {"all": [
        {"volatile": {"who": "target", "id": "rejuvenationshelter"}},
        {"attackType": "Dark"}
      ]},
      "actions": [{"op": "multiply", "value": 0.5}],
      "source": "Warped_Forest_Field.md: Standard Field Hooks (Shelter halves Dark damage); Battle_Move.rb:1845-1848"
    }
  ],
  "customVolatiles": {
    "rejuvenationshelter": {"actions": [], "source": "Warped_Forest_Field.md: Standard Field Hooks (Shelter)"}
  },
  "seed": {"item": "magicalseed", "effect": "ingrain", "duration": true, "message": "{1} planted its roots.", "stats": {"def": 1, "spd": 1, "spe": -1}},
  "seedActions": [],
  "artwork": {"file": "warpedforest.jpg", "description": "Minecraft Warped Forest screenshot (user-provided)"},
  "biomes": ["minecraft:warped_forest"],
  "structures": [],
  "notes": {
    "summary": "A twisted Nether forest that mixes Forest, Dimensional, Wasteland and a little Volcanic. Weather cannot survive here and nothing freezes.",
    "sections": [
      {"heading": "Type power", "lines": [
        "Grass, Dark and special Bug moves are 1.5× stronger. Ghost moves are 1.2× stronger.",
        "Fire moves are 1.3× stronger. Water moves are 0.8× and Ice and Fairy moves are 0.5×.",
        "Mimicry, Camouflage and Terrain Pulse use the Dark type. Nature Power becomes Wood Hammer. Secret Power can flinch.",
        "Move-specific boosts multiply with the type boost: Power Whip and Vine Whip are 1.5× on top of the Grass bonus (2.25× in total); Dark Pulse and Night Daze are 1.2× on top of the Dark bonus (1.8×) and never miss.",
        "Hyperspace Fury, Hyperspace Hole, Shadow Force and Spacial Rend are 1.5× stronger."]},
      {"heading": "Warped flora", "lines": [
        "Damaging Grass moves also count as Dark when working out type effectiveness. This includes Slash, Air Slash, Fury Cutter, Air Cutter, Psycho Cut, Breaking Swipe and Cut, which gain the Grass type here as in the Forest.",
        "The extra type changes damage only; it never adds same-type bonus.",
        "Leech Seed drains 1/4 of maximum HP each turn instead of 1/8."]},
      {"heading": "Dimensional distortion", "lines": [
        "Gravity, Magic Room, Trick Room and Wonder Room last a random 3 to 8 turns."]},
      {"heading": "Weather and status", "lines": [
        "Weather cannot be started here, and weather already in effect disappears when the field begins.",
        "Pokémon cannot be frozen."]},
      {"heading": "Abilities", "lines": [
        "Grass Pelt, Leaf Guard, Overgrow and Swarm are active as in the Forest.",
        "Effect Spore triggers 60% of the time. Sap Sipper restores 1/16 of HP each turn.",
        "Rattled raises Speed by 1 and Unnerve lowers the opposing Pokémon's Speed by 1 when they enter.",
        "Poison Heal and Toxic Boost work for grounded Pokémon."]},
      {"heading": "Seed and Shelter", "lines": [
        "Magical Seed: Defense +1, Special Defense +1, Speed −1, and the holder takes root (Ingrain).",
        "Shelter halves Dark damage to its user."]}
    ],
    "counters": []
  }
}
